[
  {
    "id": "MIG-000",
    "order": 0,
    "entity": "SchemaMigrationLedger",
    "up_ref": "database/migrations/000_create_schema_migrations.sql",
    "rollback_ref": "database/rollbacks/000_rollback_create_schema_migrations.sql",
    "checksum_required": true,
    "checksum_algorithm": "sha256",
    "applies_to": "wamp_local",
    "reversible": true,
    "rollback_mode": "schema_down_before_real_user_data",
    "ledger_required": true,
    "source_doc": "docs/06-technical/03-conventions.md",
    "artifact_state": "generated_not_executed",
    "manifest_ref": "database/manifest.json"
  },
  {
    "id": "MIG-001",
    "order": 1,
    "entity": "User",
    "up_ref": "database/migrations/001_create_users.sql",
    "rollback_ref": "database/rollbacks/001_rollback_create_users.sql",
    "checksum_required": true,
    "checksum_algorithm": "sha256",
    "applies_to": "wamp_local",
    "reversible": true,
    "rollback_mode": "schema_down_before_real_user_data",
    "ledger_required": true,
    "source_doc": "docs/06-technical/03-conventions.md",
    "artifact_state": "generated_not_executed",
    "manifest_ref": "database/manifest.json"
  },
  {
    "id": "MIG-002",
    "order": 2,
    "entity": "AuthAttempt",
    "up_ref": "database/migrations/002_create_auth_attempts.sql",
    "rollback_ref": "database/rollbacks/002_rollback_create_auth_attempts.sql",
    "checksum_required": true,
    "checksum_algorithm": "sha256",
    "applies_to": "wamp_local",
    "reversible": true,
    "rollback_mode": "schema_down_before_real_user_data",
    "ledger_required": true,
    "source_doc": "docs/06-technical/03-conventions.md",
    "artifact_state": "generated_not_executed",
    "manifest_ref": "database/manifest.json"
  },
  {
    "id": "MIG-003",
    "order": 3,
    "entity": "Role",
    "up_ref": "database/migrations/003_create_roles.sql",
    "rollback_ref": "database/rollbacks/003_rollback_create_roles.sql",
    "checksum_required": true,
    "checksum_algorithm": "sha256",
    "applies_to": "wamp_local",
    "reversible": true,
    "rollback_mode": "schema_down_before_real_user_data",
    "ledger_required": true,
    "source_doc": "docs/06-technical/03-conventions.md",
    "artifact_state": "generated_not_executed",
    "manifest_ref": "database/manifest.json"
  },
  {
    "id": "MIG-004",
    "order": 4,
    "entity": "Permission",
    "up_ref": "database/migrations/004_create_permissions.sql",
    "rollback_ref": "database/rollbacks/004_rollback_create_permissions.sql",
    "checksum_required": true,
    "checksum_algorithm": "sha256",
    "applies_to": "wamp_local",
    "reversible": true,
    "rollback_mode": "schema_down_before_real_user_data",
    "ledger_required": true,
    "source_doc": "docs/06-technical/03-conventions.md",
    "artifact_state": "generated_not_executed",
    "manifest_ref": "database/manifest.json"
  },
  {
    "id": "MIG-005",
    "order": 5,
    "entity": "RolePermission",
    "up_ref": "database/migrations/005_create_role_permissions.sql",
    "rollback_ref": "database/rollbacks/005_rollback_create_role_permissions.sql",
    "checksum_required": true,
    "checksum_algorithm": "sha256",
    "applies_to": "wamp_local",
    "reversible": true,
    "rollback_mode": "schema_down_before_real_user_data",
    "ledger_required": true,
    "source_doc": "docs/06-technical/03-conventions.md",
    "artifact_state": "generated_not_executed",
    "manifest_ref": "database/manifest.json"
  },
  {
    "id": "MIG-006",
    "order": 6,
    "entity": "UserRole",
    "up_ref": "database/migrations/006_create_user_roles.sql",
    "rollback_ref": "database/rollbacks/006_rollback_create_user_roles.sql",
    "checksum_required": true,
    "checksum_algorithm": "sha256",
    "applies_to": "wamp_local",
    "reversible": true,
    "rollback_mode": "schema_down_before_real_user_data",
    "ledger_required": true,
    "source_doc": "docs/06-technical/03-conventions.md",
    "artifact_state": "generated_not_executed",
    "manifest_ref": "database/manifest.json"
  },
  {
    "id": "MIG-007",
    "order": 7,
    "entity": "Module",
    "up_ref": "database/migrations/007_create_modules.sql",
    "rollback_ref": "database/rollbacks/007_rollback_create_modules.sql",
    "checksum_required": true,
    "checksum_algorithm": "sha256",
    "applies_to": "wamp_local",
    "reversible": true,
    "rollback_mode": "schema_down_before_real_user_data",
    "ledger_required": true,
    "source_doc": "docs/06-technical/03-conventions.md",
    "artifact_state": "generated_not_executed",
    "manifest_ref": "database/manifest.json"
  },
  {
    "id": "MIG-008",
    "order": 8,
    "entity": "ModuleManifest",
    "up_ref": "database/migrations/008_create_module_manifests.sql",
    "rollback_ref": "database/rollbacks/008_rollback_create_module_manifests.sql",
    "checksum_required": true,
    "checksum_algorithm": "sha256",
    "applies_to": "wamp_local",
    "reversible": true,
    "rollback_mode": "schema_down_before_real_user_data",
    "ledger_required": true,
    "source_doc": "docs/06-technical/03-conventions.md",
    "artifact_state": "generated_not_executed",
    "manifest_ref": "database/manifest.json"
  },
  {
    "id": "MIG-009",
    "order": 9,
    "entity": "DomainEvent",
    "up_ref": "database/migrations/009_create_domain_events.sql",
    "rollback_ref": "database/rollbacks/009_rollback_create_domain_events.sql",
    "checksum_required": true,
    "checksum_algorithm": "sha256",
    "applies_to": "wamp_local",
    "reversible": true,
    "rollback_mode": "schema_down_before_real_user_data",
    "ledger_required": true,
    "source_doc": "docs/06-technical/03-conventions.md",
    "artifact_state": "generated_not_executed",
    "manifest_ref": "database/manifest.json"
  },
  {
    "id": "MIG-010",
    "order": 10,
    "entity": "AuditLog",
    "up_ref": "database/migrations/010_create_audit_logs.sql",
    "rollback_ref": "database/rollbacks/010_rollback_create_audit_logs.sql",
    "checksum_required": true,
    "checksum_algorithm": "sha256",
    "applies_to": "wamp_local",
    "reversible": true,
    "rollback_mode": "schema_down_before_real_user_data",
    "ledger_required": true,
    "source_doc": "docs/06-technical/03-conventions.md",
    "artifact_state": "generated_not_executed",
    "manifest_ref": "database/manifest.json"
  },
  {
    "id": "MIG-011",
    "order": 11,
    "entity": "ApprovalRecord",
    "up_ref": "database/migrations/011_create_approval_records.sql",
    "rollback_ref": "database/rollbacks/011_rollback_create_approval_records.sql",
    "checksum_required": true,
    "checksum_algorithm": "sha256",
    "applies_to": "wamp_local",
    "reversible": true,
    "rollback_mode": "schema_down_before_real_user_data",
    "ledger_required": true,
    "source_doc": "docs/06-technical/03-conventions.md",
    "artifact_state": "generated_not_executed",
    "manifest_ref": "database/manifest.json"
  },
  {
    "id": "MIG-012",
    "order": 12,
    "entity": "SystemSetting",
    "up_ref": "database/migrations/012_create_system_settings.sql",
    "rollback_ref": "database/rollbacks/012_rollback_create_system_settings.sql",
    "checksum_required": true,
    "checksum_algorithm": "sha256",
    "applies_to": "wamp_local",
    "reversible": true,
    "rollback_mode": "schema_down_before_real_user_data",
    "ledger_required": true,
    "source_doc": "docs/06-technical/03-conventions.md",
    "artifact_state": "generated_not_executed",
    "manifest_ref": "database/manifest.json"
  },
  {
    "id": "MIG-013",
    "order": 13,
    "entity": "EvidenceReport",
    "up_ref": "database/migrations/013_create_evidence_reports.sql",
    "rollback_ref": "database/rollbacks/013_rollback_create_evidence_reports.sql",
    "checksum_required": true,
    "checksum_algorithm": "sha256",
    "applies_to": "wamp_local",
    "reversible": true,
    "rollback_mode": "schema_down_before_real_user_data",
    "ledger_required": true,
    "source_doc": "docs/06-technical/03-conventions.md",
    "artifact_state": "generated_not_executed",
    "manifest_ref": "database/manifest.json"
  },
  {
    "id": "MIG-014",
    "order": 14,
    "entity": "BackupRecord",
    "up_ref": "database/migrations/014_create_backup_records.sql",
    "rollback_ref": "database/rollbacks/014_rollback_create_backup_records.sql",
    "checksum_required": true,
    "checksum_algorithm": "sha256",
    "applies_to": "wamp_local",
    "reversible": true,
    "rollback_mode": "schema_down_before_real_user_data",
    "ledger_required": true,
    "source_doc": "docs/06-technical/03-conventions.md",
    "artifact_state": "generated_not_executed",
    "manifest_ref": "database/manifest.json"
  },
  {
    "id": "MIG-015",
    "order": 15,
    "entity": "DecisionRecord",
    "up_ref": "database/migrations/015_create_decision_records.sql",
    "rollback_ref": "database/rollbacks/015_rollback_create_decision_records.sql",
    "checksum_required": true,
    "checksum_algorithm": "sha256",
    "applies_to": "wamp_local",
    "reversible": true,
    "rollback_mode": "schema_down_before_real_user_data",
    "ledger_required": true,
    "source_doc": "docs/06-technical/03-conventions.md",
    "artifact_state": "generated_not_executed",
    "manifest_ref": "database/manifest.json"
  },
  {
    "id": "MIG-016",
    "order": 16,
    "entity": "UserContext",
    "up_ref": "database/migrations/016_create_user_contexts.sql",
    "rollback_ref": "database/rollbacks/016_rollback_create_user_contexts.sql",
    "checksum_required": true,
    "checksum_algorithm": "sha256",
    "applies_to": "wamp_local",
    "reversible": true,
    "rollback_mode": "schema_down_before_real_user_data",
    "ledger_required": true,
    "source_doc": "docs/06-technical/03-conventions.md",
    "artifact_state": "generated_not_executed",
    "manifest_ref": "database/manifest.json"
  },
  {
    "id": "MIG-017",
    "order": 17,
    "entity": "OnboardingSession",